{
  "$schema": "./checkpoint-schema.json",
  "version": "1.0",
  "activeTask": {
    "id": "hisaab-fatafat-invoice-page",
    "name": "Hisaab Fatafat Invoice Page - Swipe Style",
    "description": "Implement Swipe-style invoice list page with full functionality",
    "targetPath": "D:\\Sayan\\Projects\\Hisaab_Fatafat_2",
    "startedAt": "2026-04-04T04:08:00+05:30",
    "updatedAt": "2026-04-04T05:22:00+05:30"
  },
  "progress": {
    "phase": "implementation",
    "phaseDescription": "Implementing invoice page with Swipe-style UI",
    "percentComplete": 85,
    "completedSteps": [
      {"id": "install-composer", "name": "Installed Composer and PHP dependencies", "timestamp": "2026-04-04T04:18:00+05:30"},
      {"id": "setup-sqlite", "name": "Set up SQLite database for development", "timestamp": "2026-04-04T05:20:00+05:30"},
      {"id": "update-frontend", "name": "Updated InvoiceList.jsx with Swipe-style UI", "timestamp": "2026-04-04T04:46:00+05:30"},
      {"id": "update-backend-controller", "name": "Updated InvoiceController with search, filter, sort, summary", "timestamp": "2026-04-04T05:12:00+05:30"},
      {"id": "update-invoice-model", "name": "Added new fields to Invoice model", "timestamp": "2026-04-04T05:12:00+05:30"}
    ],
    "currentStep": {
      "id": "verify-functions",
      "name": "Verify all functions work (search, filter, sort)",
      "status": "in_progress",
      "startedAt": "2026-04-04T05:22:00+05:30",
      "notes": "Frontend and backend running. Need to verify functionality and fix any SQLite column issues."
    },
    "pendingSteps": [
      {"id": "add-database-columns", "name": "Add reference, shipping_bill_number, shipping_bill_date, shipping_port_code columns to invoices table"},
      {"id": "test-api-endpoint", "name": "Test /api/invoices endpoint with all parameters"},
      {"id": "verify-ui-interactions", "name": "Verify tab filtering, search, sorting work in UI"}
    ]
  },
  "blockers": [],
  "nextAction": "Fix SQLite column addition and verify API works with new fields",
  "delegations": [],
  "heartbeats": [
    {"timestamp": "2026-04-04T05:23:00+05:30", "action": "UPDATED_CHECKPOINT", "notes": "Added Hisaab Fatafat invoice page task to checkpoint. Work in progress."}
  ]
}
